common_voice_mn_40419818|unused|Амьдрал яг одоо цаг дээр л аз жаргалтай байдаг.
common_voice_mn_40419831|unused|Тийм болохоор би ямар ч ажил байсан хамаагүй хийнэ.
common_voice_mn_40419902|unused|Юу ч гэсэн бригадын төвд суу гэхээр нь бухимдсан хэрэг.
common_voice_mn_40419938|unused|Хөгшрөх тухай ярих арай болоогүй байна.
common_voice_mn_40419953|unused|Тэд радио харилцааг таслахгүй байхыг цөхрөн гуйж байжээ.
common_voice_mn_40426574|unused|Өсвөр насны хүүхэд яагаад өмнөө ахадсан зорилт тавих ёстой гэж бичсэнээ тайлбарлая.
common_voice_mn_40426712|unused|За чамтай уулзсан маань бүр сайн хэрэг боллоо.
common_voice_mn_40426713|unused|Амьдралынхаа будилж явсан замыг эргэж харахад инээд ч хүрэх шиг, айдас ч төрөх шиг.
common_voice_mn_40426746|unused|Эдгээр ажлын бэлтгэл явцад хяналт тавина.
common_voice_mn_40426760|unused|Түүний хажууд "яая даа, хуурамч аттестатаар залилсан хэрэг сөхөгдөнө" гэхээс өөр юм ер бодогдсонгүй.
common_voice_mn_40426849|unused|Изенгардын хажууханд саатаад байх шаардлага байхгүй.
common_voice_mn_40426851|unused|Тэр хуруугаараа сайн мэдэрдэг.
common_voice_mn_40426920|unused|Хэдийнээ амжиж хамгаалах чагтыг нь мулталчихсан харагдана.
common_voice_mn_40426978|unused|Энэ чинь харин шилдэг санаа байна.
common_voice_mn_40427065|unused|Ингээд одоо л нэг юм цагдаагийн мөрдөгчийн хорон явуулгыг ойлгожээ!
common_voice_mn_40433468|unused|Чи үүгээрээ юу хэлэх гэсэн юм бэ?
common_voice_mn_40433470|unused|Тэр бээр торгуулийн тойрогт Мороккогийн жүдочийг цэвэр ялснаар медалийн төлөө барилдахаар болов.
common_voice_mn_40433491|unused|Ээлжлээд л нөгөө сээрийг нүцгэн нударгаараа дэлсэх юм.
common_voice_mn_40433574|unused|Шүүгчид томилолтоор ажиллахад бензиний зардлаас эхлээд төсөв санхүү хумигдмал байдалтай байна.
common_voice_mn_40433617|unused|Зочны өрөөний ханын цаг шөнийн хоёр цаг болсныг дохиолов.
common_voice_mn_40433634|unused|Муж улсуудын хилээр бараа чөлөөтэй нэвтрэх боломжтой болох нь шинэчлэлийн нэг давуу тал.
common_voice_mn_40433770|unused|Өөрийгөө ядуугийн дүрд тоглож буй авъяаслагжүжигчин гээд л бодчих.
common_voice_mn_40433775|unused|Төвийн өмнөхнүүр уулын гол жирэлзэн урсаж, хар модон ой үргэлжлэн сүглийнэ.
common_voice_mn_40433784|unused|Дундад Азийн цайны түүхэн дэх их өөрчлөн шинэчлэлт Туркестан Төв Азийг колоничилж эхэлснээс үүдэлтэй.
common_voice_mn_40433818|unused|Эрх баригчдаас бус, эмнэлгийнхээ удирдах зөвлөлөөс зөвшөөрөл авах нь л доктор Вүд хангалттай байжээ.
common_voice_mn_40433923|unused|Гэвч тэр өчигдөр хэн байв гэдгийг би мэдэхийг хүсэж байна.
common_voice_mn_40433930|unused|Өглөө эртлэн зочид буудалд ирэх өөр ямар хүн байж болох вэ?
common_voice_mn_40433951|unused|Бид хоёр наранд гарсан хойноо ганц шил юм хувааж уугаад гал хам болчихсон.
common_voice_mn_40433952|unused|Би танд тусалж чадах байх гэж бодож байна.
common_voice_mn_40433954|unused|Зам дээр могой хөндлөн хэвтэхийг муу ёр гэдэг юм.
common_voice_mn_40433980|unused|Хүүгээ явуул гэсэн болохоос чамайг ир гээгүй гэжээ.
common_voice_mn_40433983|unused|Абдул Рахманы үгийг сонсоод хатантны царай барайгаад явчихлаа.
common_voice_mn_40434004|unused|Сэжигтний хариу үйлдэл түүнийг бүрэн илчилж байна гэжээ.
common_voice_mn_40434013|unused|Очсоных нь маргааш хоёр өрөө эвсээрхэн байшин өгчээ.
common_voice_mn_40434112|unused|Энх тайвныг бэхжүүлэх, бүх нийтийн аюулгүй байдлыг хангах заалтууд бичээтэй л байгаа.
common_voice_mn_40434131|unused|Хэлэх цаг нь болсон мэт зөн совин хөтөллөө.
common_voice_mn_40562335|unused|Бидний ажлын үр дүн гарч, хүүхдүүд маань сайхан орчинд үйлчлүүлэх боломжтой болсонд баяртай байна.
common_voice_mn_40574082|unused|Ховын үгэнд хол ойр гэж үгүй, хорт могойд бүдүүн нарийн гэж үгүй.
common_voice_mn_40575561|unused|Анчид Сибирь буюу тайгаас өнөөгийн тал нутагт бууж ирсэн гэж үздэг.
common_voice_mn_40439951|unused|өдрийн тэмдэглэлээ нөгөө талд нь байрлуул.
common_voice_mn_40440025|unused|Оршин байгаа "олон нийтийн соёл" тэдний ижилслийг тодорхойлох гол хэмжүүр болно.
common_voice_mn_40440119|unused|Жижүүрийн бүрэлдэхүүн үзлэгээ хийж эхлэн хэргийн газраас эд мөрийн баримт хайж байлаа.
common_voice_mn_40440130|unused|Цааш мориор аялах ёстой учир газарчид маань адуугаа хураан ирж буй нь энэ аж.
common_voice_mn_40440138|unused|Цаг хугацаа өнгөрөх тусам компаниуд нөөцөө хавьгүй илүү сайн удирдаж сурсан.
common_voice_mn_40440153|unused|Битгий уйл даа хонгорхон охин минь.
common_voice_mn_40440160|unused|Эрлийн үзүүрт юу эс байх аж.
common_voice_mn_40440161|unused|Би чинь хаан болохоосоо өмнө цэрэг байсан хүн шүү.
common_voice_mn_40440193|unused|Дахиад гарч ирэхэд нь нэгэн гэрийн чинээ цагаан чулуу замыг нь бөглөсөн байв.
common_voice_mn_40440204|unused|Энэ хэр яагаад ч юм бэ, торгон тэрлэг өмсөж, цоо шинэ карбин буу үүрчээ.
common_voice_mn_40440208|unused|Дипломын боловсрол бус, мэргэжлийн боловсролыг чухлыг хаа хаанаа ойлгож хэрэгжүүлэх хэрэгтэй байна.
common_voice_mn_40440257|unused|Хашаатын төв дээр надад одоохондоо сангаас гэр барьж өгөх байх.
common_voice_mn_40440282|unused|Тиймээс, маш тодорхой бичгийн дурсгал байх л хэрэгтэй.
common_voice_mn_40440287|unused|Ээжтэйгээ уулзчихаад буцаад хүрээд ирэхгүй юу?
common_voice_mn_40440315|unused|Тэгэхдээ, бүр гэрийнхэн маань эсэргүүцэж, эмээгээ тэвчээрээ бартал нь номд шимтдэг байв.
common_voice_mn_40440331|unused|Бодит байдалд тулгуурладаг нь шинжлэх ухааны зарчим мөн.
common_voice_mn_40440343|unused|Энэ дээрээс л их хэмжээний мөнгө завших бололцоо үүсдэг юм байна.
common_voice_mn_40440365|unused|Зочид буудалд маань маргааш өглөө есөөс хойш хэзээ ч ирж болно.
common_voice_mn_40440374|unused|Санжаасүрэнгийн Зоригийг Улсын Их Хурлын төрийн байгуулалтын байнгын хорооны даргаар батлав.
common_voice_mn_40443056|unused|Би түүнд шилэн аягаар дахин шингэн уулгахад бага зэрэг тайвширлаа.
common_voice_mn_40443082|unused|Намайг заримдаа их аашилдаг, харин аавыг ирэхээр их сайхан зантай болдог гэв.
common_voice_mn_40443119|unused|Баатар тэргүүнээ ил гаргах учиртай гэж дуу алдав.
common_voice_mn_40443173|unused|Нүдэндээ ч зүрхлэн итгэж чадахгүй байна.
common_voice_mn_40443182|unused|Хохирогч тал нь хүртэл гомдол гаргалгүй өнгөрчээ.
common_voice_mn_40444642|unused|Ухаан санаанд нь юу ч орсонгүй.
common_voice_mn_40444693|unused|Тэгснээ будаг шунхаа хаман гүйж одлоо.
common_voice_mn_40444910|unused|Мөнгө хоол болдоггүйг бүгд ухаарах болно.
common_voice_mn_40444987|unused|Тэднээс өрсөж чамайгаа аврахаар миний угтаж яваа царай энэ.
common_voice_mn_40444997|unused|Харин халуун нар газрын хөрсийг цоонотол шарах нь бэрх хэцүү юм.
common_voice_mn_40445023|unused|Үүнийгээ л мэргэжил гээд байгаа юм.
common_voice_mn_40445024|unused|Сэрээе юү гэснээ нойрсог доо гэж бодоод эргэж хэвтэв.
common_voice_mn_40445109|unused|Тэднийг өөрсдийг нь барьцаанд авах хэрэгтэй!!!
common_voice_mn_40445243|unused|Түүний байдал нь дэргэдүүрээ хүн гарахад, дээгүүр харж төв байдлыг гаргана.
common_voice_mn_40445282|unused|тэгээд ач хүүгээ авахаар яваад өгөхгүй юу.
common_voice_mn_40445346|unused|Би түүнд аяга хатуу дарс өгөхийг тушаав.
common_voice_mn_40446903|unused|Яваандаа амьдрал дээр, бодлогын төлөөх задлан шинжилгээний хандлага маш алдартай болж ирсэн.
common_voice_mn_40446912|unused|Ингэхэд танай тасгийн захирал залууг хэн гэдэг гэлээ дээ?
common_voice_mn_40446916|unused|Чамайг эмэгтэйчүүдийн дунд ийм нэр хүндтэй гэж толгойд минь буусангүй.
common_voice_mn_40446918|unused|Энэ бол хэдэн хэнхэг өвгөний цуглаан.
common_voice_mn_40447000|unused|Би чамд хайлна гэж бүү бод.
common_voice_mn_40447067|unused|Тэр хүмүүсийн төлөө байгуулагдсан бүх төрлийн ажил олгодог газарт очив.
common_voice_mn_40447083|unused|Хүн зөвхөн тодорхойгүй бүрхэг зүйлсээс л айдаг.
common_voice_mn_40447085|unused|Ээ чааваас дээдийн гэгээнтэн минь!
common_voice_mn_40447094|unused|Хоногийн тоо нь гүйцээгүй л бол хүн гэдэг долоон голтой чөтгөр.
common_voice_mn_40451755|unused|Хаан ард түмнээ сайн мэдэх үүрэгтэй.
common_voice_mn_40162905|unused|Чихэнд чимэггүй сэдэв хөндөж байгаадаа хүлцэл өчье.
common_voice_mn_40162909|unused|Монгол хэлний ихэр хэмээх үг түрэг хэлний хоёрын тооны нэр 'ики'-ээс гаралтай.
common_voice_mn_40163393|unused|Хийчихмээр ажил мөн ч их байна даа.
common_voice_mn_40163519|unused|Зарим тохиолдолд зөвхөн санхүүгийн хөрөнгийг барьцаалдаг.
common_voice_mn_40167706|unused|Би Америкт байхдаа Монголын талаар нэг их сонсож байгаагүй.
common_voice_mn_40167714|unused|Шингэн юм уухгүй болохоор толгой өвдөг.
common_voice_mn_40167724|unused|Хүний юм аваад явчих бас хэцүү.
common_voice_mn_40167727|unused|Ингээд хүү өөрийн эцэг эхээ авч ирэхээр очиход ядарсан байв.
common_voice_mn_40167728|unused|Унтраах гэж ус цацаад ч нэмэргүй арай л сууцаа бүхэлд нь түймэрдчихсэнгүй.
common_voice_mn_40167731|unused|Түүний гэрэл туссан газар ариусан цэвэрлэгдэж алтан шар зам болон хувирах ажээ.
common_voice_mn_40167732|unused|Хүнд юм өргөхлөөр түүний нуруу өвддөг.
common_voice_mn_40167752|unused|Харин тэд таны хойноос хөөцөлдөөд анзаараагүй бололтой.
common_voice_mn_40167762|unused|Ай мөн ч завхарсан юм болж байна даа.
common_voice_mn_40174339|unused|Надад илүү мөнгө хэрэггүй ээ.
common_voice_mn_40174341|unused|Түүнд сайхан санагдсан.
common_voice_mn_40174362|unused|Хаашаа л харвал зуны сарын байгаль хээ хуар шиг сайхан дурайна.
common_voice_mn_40174374|unused|Цаашилтал мөн л нэг чимээ гарлаа.
common_voice_mn_40174376|unused|Тоотой хэдэн хань ижлийнхээ өөдтэйг та нар аллаа.
common_voice_mn_40174388|unused|Чи яаж тэр жаал хүүд армийнхаа тэн хагасыг алдаж чадав?
common_voice_mn_40174400|unused|Цэнхэр даашинзтай бүсгүй уйлан сууж байв.
common_voice_mn_40174413|unused|Сонголт бол үргэлж баталгаатай байдаг зүйл биш.
common_voice_mn_40174419|unused|Гэтэл ийм үс ноостой бүсгүй хүнийг энэ яваа насандаа үзэж дуулаагүй сэн.
common_voice_mn_40174422|unused|Гэхдээ энэ бол хуурамч баг байжээ.
common_voice_mn_40174425|unused|Би тиймэрхүү ярианд нэг их сайн биш.
common_voice_mn_40174430|unused|Өнөөдөр бид хоёр хамт байсандаа тэднийг айлгаж дөнгөсөн.
common_voice_mn_40174434|unused|Харин ах нь бүр сүүлд энэ бүхний учрыг ойлгодог.
common_voice_mn_40197458|unused|Аль нь илүү ихээр сэтгэлээ зориулж байна вэ?
common_voice_mn_40197521|unused|Усан үзмийн модны мөчрийг дараах байдлаар ангилж болно.
common_voice_mn_40197538|unused|Өвлөөс хойш үзэгдээгүй учир надад их л сонин сайхан санагдав.
common_voice_mn_40197547|unused|Энэ овгор харууд урьдаас зэхэж бэлтгэсэн хориглолтын байр байх нь.
common_voice_mn_40197575|unused|Ажлын өдөр ингэсэн бол ч хэл ам гарч бөөн асуудал үүснэ шүү дээ.
common_voice_mn_40197595|unused|Тэд тэндээсээ бууж өндөр хясааны ар дахь том жижиг агуйнуудаар орж үзэх болов.
common_voice_mn_40197601|unused|Хаа сайгүй хогондоо дарагдсан байдал хүн нэг бүрийн хүчин зүтгэлээр л цэмцийнэ.
common_voice_mn_40197602|unused|Нэлээд бодсоны эцэст ийм шийдвэр гаргаж байсан.
common_voice_mn_40197610|unused|Дарь эхийн даллага уншуулж айл гэрийн хишиг буян, үр хүүхдийн хишиг буяныг тогтооно.
common_voice_mn_40197633|unused|Би бушуухан эргэж зуурмаг хийдэг газраа очив.
common_voice_mn_40197650|unused|Хүүхдүүдээ өсгөж хүмүүжүүлэхэд гар бие оролцдог байв уу?
common_voice_mn_40197654|unused|Гэтэл тэр охин нэг л өөр.
common_voice_mn_40197740|unused|Ундрах хүж асаан, номын мөр дагуулан уншиж суужээ.
common_voice_mn_40197797|unused|Миний хэдэн удаагийн хатуухан сорилтыг давсан хүн дээ.
common_voice_mn_40197801|unused|Үүний урьд Сахиустай ажил төрлийн холбоотой байсан нэг хүн ярьж байна.
common_voice_mn_40197807|unused|Аливаа түүх амьдрал тэмцэл ба үхлийн зорилго юу юм бэ?
common_voice_mn_40197833|unused|Хэрэв тийм бол энэ хүн амины хэрэг гэж сэжиглэж эхэлнэ.
common_voice_mn_40197840|unused|Гэхдээ өмчийг хувьчлах санал бас менежментийн эрдэмтдээс гарсан.
common_voice_mn_40197869|unused|Таны л мэдэх хэрэг шүү дээ.
common_voice_mn_40197872|unused|Хүүхдүүд ядрахлаараа уйлдаг.
common_voice_mn_40197879|unused|Сэжигтэн дээр бүх төрлийн нууц хяналтын арга хэмжээг авав.
common_voice_mn_40197881|unused|Хэрвээ энэ бейсболын тэмцээн шиг байсан бол энэ эрэгтэй ялагдагч юм.
common_voice_mn_40197888|unused|Гэвч бүх оюун сэтгэл минь эндээс яв гэж шаардаж байна.
common_voice_mn_40197892|unused|Гэхдээ та намайг эрж яваа юм биш биз?
common_voice_mn_40197915|unused|Дараа нь тоглож байх үедээ түүнийг өөдөөс минь харан зогсож байхыг анзаарсан билээ.
common_voice_mn_40197924|unused|Багш лам Ундрахыг монгол ном үзүүлэхгүй гэж үргэлж чандлан хянаж байв.
common_voice_mn_40198002|unused|Гэхдээ ээжээсээ яав ийв гэж юу ч асуусангүй, ээж нь ч юм ярьсангүй.
common_voice_mn_40198006|unused|Танд юу хэрэгтэйг танаас өөр хэн ч сайн мэдэхгүй.
common_voice_mn_40198058|unused|Бас түүний ажил ч гэсэн пуужинтай холбоотой.
common_voice_mn_40198147|unused|Тосгоноосоо ер холддоггүй болохоор та минь ч яаж мэдэх вэ дээ.
common_voice_mn_40198249|unused|Ийм чөлөөтэй сэлгэдэг байдал асуудлыг лавшруулахаас бус, шууд шийдэхгүй.
common_voice_mn_40198253|unused|Хэрэв би шүлэглэх авьяастай сан бол хэдэн мөр юм заавал бичих байсан.
common_voice_mn_40198320|unused|Ахуйн аливаа өөрчлөлтийг дурамжхан хүлээж авдаг.
common_voice_mn_40198348|unused|Өөрийг нь сэм сэмхэн ажиж явааг минь тэр гадарлаж байлаа.
common_voice_mn_40399367|unused|Энд хар шороонд булуулан тав тух алдаж байх хэрэг юун.
common_voice_mn_40399401|unused|Тэр хоёр бие биенээ шинжин зогсов.
common_voice_mn_40596492|unused|Гэтэл бидний урагш явах замыг хөндөлсөн хязгаарлах мэт их мөрөн цэлийн харагдав.
common_voice_mn_40308341|unused|Нэгэнт эдгээр найман үзэл үгүй болсон үед бид нирваанд хүрдэг.
common_voice_mn_40308343|unused|Өвлийн хүйтэн хангинаж байтал, дан сармай дээлтэй явах чинь яасан зутарсан үр вэ дээ.
common_voice_mn_40308370|unused|Та миний явсны дараа утсаар ярьсныг хэлж байна уу?
common_voice_mn_40308375|unused|Тэд гэрээний сэтгэл гонсойлгосон үр дүнгийн тухайд хэд хэдэн боломжтой тайлбарыг санал болгож байна.
common_voice_mn_40308376|unused|Мэдээ хүргэхээр чи минь буцаж болоогүй юм байх даа гэж харуусан санана.
common_voice_mn_40308384|unused|Монгол соёлд өсөж байгаа залуу үеийнхэн Монголоо гэх сэтгэл, хүндэтгэл ихтэй болж төлөвшдөг.
common_voice_mn_40328404|unused|Гэвч тэрбээр нэг их удалгүй баригдсан байлаа.
common_voice_mn_40328408|unused|Мөн тэрээр өөрийн давуу талуудынхаа талаар бодов.
common_voice_mn_40328426|unused|Саарал Минж сая л гараа буулгав.
common_voice_mn_40328427|unused|Нийслэлд өдөрт нэгээс олон зэвсэг иргэдийн эзэмшилд очсон гэсэн үг.
common_voice_mn_40328437|unused|Харин атаархагчдад ийм хувь заяа дутдаг.
common_voice_mn_40328461|unused|Мэдээлэл, харилцаа холбооны асуудал эрхэлсэн төрийн захиргааны байгууллагын эрх үүрэгтэй танилцах учиртай.
common_voice_mn_40328465|unused|Мэдээлэл хэт ачаалагдах үзэгдэл нь дэс дараатай, зөв хөгжүүлсэн хураангуйлуур амин чухал гэдгийг илтгэдэг.
common_voice_mn_40328472|unused|Буш бүх зүйл нь төгс байх албагүй компанит ажлыг мөрдөх маш энгийн аргатай.
common_voice_mn_40328473|unused|Төлөвлөгөө тасалбал бид түүнээс дор зэмлэл сонсоно.
common_voice_mn_40328497|unused|Нийгмийн сүлжээ гэдэг долоон булчирхай, найман найлзуурхайгаа тоочдог газар биш ээ.
common_voice_mn_40328559|unused|Ийм үед хүүхдийг зөв чиглүүлэн сэтгэл зүйн дэмжлэг туслалцаа үзүүлэх хэрэгтэй.
common_voice_mn_40328565|unused|Зарим хүмүүс хөшөөнүүд бол ач холбогдолгүй гайхамшиг мэт ярьдаг.
common_voice_mn_40328576|unused|Юуны өмнө эсрэг хүнтэйгээ адил сэтгэгдэлтэй байх.
common_voice_mn_40328602|unused|Бас могойг эмэгтэй хүнтэй хавьтдаг гэлцэнэ.
common_voice_mn_40328624|unused|Танд Төрийн шагнал олгох эрх байхгүй биз дээ?
common_voice_mn_40328630|unused|Зарим хүүхэд сэтгэл шимширсэн бололтой санаа алдав.
common_voice_mn_40328654|unused|Үндэстэн дамнасан компаниуд Хятад мэтийн хөгжиж буй орнуудын зах зээлийн урсгалд тэсэхгүй.
common_voice_mn_40328659|unused|Хатантан өргөөндөө бараалхаж энэ шөнө амарна уу?
common_voice_mn_40370200|unused|Хуванцар тоглоомд хүүхдүүд элс дүүргэн хийж элдэв янзын хэлбэр гарган тоглодог сон.
common_voice_mn_40370218|unused|Та яагаад намайг та гэж дуудаад байгаа юм бэ?
common_voice_mn_40370237|unused|Хүүхдүүдийн дунд бүжиглэх Янжмаа багш нь тэднийг инээмсэглэн харна.
common_voice_mn_40415568|unused|Дэлхийн хоёрдугаар дайн эхлэхэд Фрэнк дорнод Африкт хээрийн судалгаа хийж байжээ.
common_voice_mn_40415590|unused|Гэхдээ би хүнээр өөрийгөө өрөвдүүлэх хэрэгцээ надад байхгүй.
common_voice_mn_40415610|unused|Тэр энэ хоёр асуултад ердөө нэг л хариулт байгаа гэдэгт эргэлзэхгүй байв.
common_voice_mn_40415614|unused|Бид ч дархан цаазат ууландаа очоод эрүүл агаараар амьсгалж, зүй зохистой зугаалах нөхцөл бүрдэнэ.
common_voice_mn_40415625|unused|Герман технологиор нь үйлдвэрлээд Герман болон Америкт борлуулдаг гэхээр итгэж болмоор санагдлаа.
common_voice_mn_40415638|unused|Мансууруулах тарианд донтсоноос болж, гэр бүлд нь түүнээс холдож, зугтаахаас өөр сонголт үлдсэнгүй.
common_voice_mn_40415655|unused|Жүгдэрнамжилын дончид номыг өвчин зовлон, гай барцдыг арилгахад айлтгуулна.
