common_voice_mn_40572051|unused|Тиймээс үг гэдэг бол хэзээд удирдагчийн хүчирхэг зэвсэг болдог билээ.
common_voice_mn_40572110|unused|Над шиг итгэлгүй зарим нэг үзэл бодолтой нь эвлэрч чадахгүй болчихвол тусгүй байх.
common_voice_mn_40572158|unused|Хэл ороод босож ирвэл аюул гэдэг тэр.
common_voice_mn_40572186|unused|Тэр өөрийгөө үргэлж үнэнч Англи хүн гэж үздэг, тэр бодолдоо туйлын итгэлтэй байдаг байв.
common_voice_mn_40572498|unused|Эрт үед байлдааны нум сумаар харвах үед хэрэглэдэг байсан юм.
common_voice_mn_40572814|unused|Үгүй бол юу болохыг гадарлаж байгаа биз дээ?
common_voice_mn_40573294|unused|Бурхан Багшийн дуудлага магтаал хэмээх номыг ажил үйлс бүтээх, амьдрал ахуйг сайжруулахад айлтгуулна.
common_voice_mn_40585190|unused|Галдан бошигт хаан хээрийн майхандаа гурван хоног гашуудан дуугаа хураав.
common_voice_mn_40586032|unused|Хийх бүхнээ гүйцээсэн болохоор одоо нойр хүрэхийг хүлээн хөдлөлгүй хэвтэнэ.
common_voice_mn_40586219|unused|Өдөр тутмын амьдралын дунд хувраг хүний сэтгэл ямагт ариун байх ёстой.
common_voice_mn_40586760|unused|Гуанз үүнээс илүү хөл бужигнасан байж үзээгүй билээ.
common_voice_mn_40587044|unused|би амьдралаа юм бодож өнгөрөөхгүй шүү гэв.
common_voice_mn_40587499|unused|Лагшин нь тийм ч сайн биш харагдсан шүү.
common_voice_mn_40587604|unused|Хүний хөгжлийн онолоор хүмүүсийг уламжлалт болон иргэншсэн гэж хоёр ангилдаг.
common_voice_mn_40591502|unused|Чи гэр бүлтэй болсон бол өөр хүүхний захиа уншин суух нь чамд ч эвгүй.
common_voice_mn_40591604|unused|Борисын шарилд босгох боломжийн дээд хөшөө.
common_voice_mn_40391349|unused|Монгол бичгийн зуун дамнах шандас цаг цагийн амьсгалд өчүүхэн төдий үл саатах нигууртай ажээ.
common_voice_mn_40391352|unused|Тэрхэн зуур Цэрэгмаагийн чихэнд ямар нэг эвгүй үг сонстох шиг болжээ.
common_voice_mn_40391354|unused|Балжийн голын лагийг цэнхэр ажлын хувцас өмссөн хэдэн хүн цэвэрлэж эхлээд байгаа.
common_voice_mn_40391446|unused|Дадлага хийх, ажилд орох хүсэлтэй залуус манай редакцаас тасардаггүй. УНШИХГҮЙ БОЛ СЭТГЭХГҮЙ.
common_voice_mn_40391485|unused|Энэ нэрийг манай эрдэмтэд "Цахим хэлшинжлэл" гэснийг дэмжиж байна.
common_voice_mn_40391534|unused|Ийм ч учраас тэмдэглэлт өдрүүдийн хоорондох бүх жижиг зайг мэргэн үгээр дүүргэсэн гэжээ.
common_voice_mn_40391575|unused|Хараацай хэдгэнэ хоёр зарлиг ёсоор нисэн оджээ.
common_voice_mn_40391605|unused|Күнзийн үзэл бодлын гол сургаал нь хуучинсаг шинж чанартай байдаг юм.
common_voice_mn_40391615|unused|Хотондоо ороогүй хоньд хашаа тойрон сул эргэлдэж зарим нь белоруссын дугуй шөргөөн үнэрлэх ажээ.
common_voice_mn_40391649|unused|Хатагтай элчин сайд таны зарц нарыг танилцуулъя.
common_voice_mn_40424833|unused|Японы нийслэл Токиод Америкчуудын Борооны хот гэж нэрлэдэг Сиэтллтэй адил хэмжээний тунадас унадаг.
common_voice_mn_40424872|unused|Охид чарлаад л бүгд ухаан жолоогүй гүйцгээлээ.
common_voice_mn_40424907|unused|Ердөө нуруугаар сэлэх, өврөөр сэлэх, эрвээхэй, чөлөөт сэлэлт гэчихэд л болох юм.
common_voice_mn_40424911|unused|Япон улсын Кибер аюулгүй байдлын сайд Ёшитака Сакурада компьютер хэрэглэж үзээгүйгээ хүлээн зөвшөөрчээ.
common_voice_mn_40424915|unused|Яах аргагүй Галдангийн дэргэд тэгш өнцөгт чулууны хажууд өндөр гэгээн зогсож байв.
common_voice_mn_40424916|unused|Дээврийг нь мод, шилээр хийсэн бөгөөд хэдэн хуучин ширээ, нэг самбар, бас зуухтай.
common_voice_mn_40424922|unused|Дайнд мордохдоо мяндсан шатаа авч яваарай.
common_voice_mn_40424953|unused|Энэ нум сумыг зориуд сойж ямар нэгэн амьтан орж ирэхэд нь харваж алахаар тааруулжээ.
common_voice_mn_40424990|unused|Үүнээс болж компани нь дампуурч байгаа гэсэн цуу яриа ихээхэн гарах болов.
common_voice_mn_40425021|unused|Найз маань уурлахаараа чанга ярьдаг.
common_voice_mn_40425031|unused|Энэ утгаараа хүүхэд гэдэг уян хатан тэдний ертөнцөд бүх зүйл чөлөөтэй.
common_voice_mn_40425032|unused|Гэвч түүний нүдэнд бол инээмсэглэл байгаагүй.
common_voice_mn_40425039|unused|Тэгээд минутын зуур гялс алга болж байгаа нь учиртай гэж ярилцсан гэдэг.
common_voice_mn_40425069|unused|Хүндэтгэлийн арга хэмжээнд эмэгтэйчүүд биед эвтэйхэн даашинз өмсөх нь хамгийн тохиромжтой гэж зөвлөлөө.
common_voice_mn_40425128|unused|тав дээр нэмэх нь дөрөв
common_voice_mn_40425140|unused|Бурханы шашин христийн шашны үйл ажиллагааны зарим хэлбэрийг тусгаж авахад буруудах зүйлгүй.
common_voice_mn_40425144|unused|Тус отрядын удирдагчдыг гестапогийнхан баривчилсан нь удалгүй мэдэгджээ.
common_voice_mn_40425183|unused|Гэтэл цооргонын год шиг бүдүүн бүдүүн иш үлдээсэн хов хоосон талбай цайвартан угтаж билээ.
common_voice_mn_40425201|unused|Тэр бүсгүй цээжээрээ арай элбэгдсэн бор тэрлэг өмсөж, шинэхэн самбай даавууг үсээ бүрхүүлэн зангиджээ.
common_voice_mn_40425221|unused|Шинэ жилийн дараахан жихүүн хүйтэн нэг өдөр амьдралдаа мартамгүй ихээр баярлаж билээ.
common_voice_mn_40425247|unused|Дасгалжуулагчийнх нь зардал бүтээгүй учир ердөө уралдах зөвлөгөөгөө аваад л Чех улсыг ганцаараа зорьсон.
common_voice_mn_40425270|unused|Харин би тийшээ явахгүй гэж хөөцөлдөөд, чадал хүрээгүй юм.
common_voice_mn_40425322|unused|Анх эхэлж байсан үе одоо биш болов.
common_voice_mn_40595726|unused|Бусад хүмүүсийн шаардлага ч мөн адил.
common_voice_mn_40595856|unused|Буг ч болсон, юу ч болсон би түүнтэй заавал уулзах ёстой гэсээр зүглэлээ.
common_voice_mn_23409370|unused|Хэдэн жил унтаа байсны эцэст олимп дөхөхөөр гэнэт сэхээ орсон мэт шуурмааргүй байна.
common_voice_mn_23409421|unused|Өө ээжээрээ овоглосон юм байна гэж бодно.
common_voice_mn_23409422|unused|Ихэнх сүм хийдүүдэд зан үйлийг үйлдүүлэх тарифыг тогтоогоогүй боловч зарим нь тарифтай байдаг байна.
common_voice_mn_23409425|unused|Багш нарыг түүний зөвшөөрлөөр л томилж байсан.
common_voice_mn_23409451|unused|Түүнтэй яриаг үргэжлүүлэх нь утгагүй юм гэж Кириллд санагдлаа.
common_voice_mn_23409455|unused|Түүний бизнес болоод туршлагын талаарх лекцийг текстээр болон видео хэлбэрээр үзэх боломжтой.
common_voice_mn_23409477|unused|Хүн амын урт наслалтаар тэргүүлдэг Япон маш оньсого шиг орон.
common_voice_mn_23409502|unused|Хүссэн бүхнийг нь зөвшөөрөх нь буруу ишилсэн сүх л хийж байгаатай адил.
common_voice_mn_23409521|unused|Өөрийн амьдрал бие сэтгэлээ золиосонд гаргаснаас сүүдэртэй талд суугаад байсан нь дээр.
common_voice_mn_23409525|unused|Одоо яаж ч хөөцөлдөөд нэмэргүй болсон.
common_voice_mn_23409544|unused|Байгаль дэлхийн шинжлэлийн ийм нарийн юмыг сурч мэдэх цаг зав ч байсангүй.
common_voice_mn_23409561|unused|Дарамтална гэдэг бол нэгэн зүйлийн гэмт хэрэг.
common_voice_mn_23409571|unused|Майхнаас гурван залуу гарч ирээд яаж мэндлэх ч учраа олохгүй сандрахдаа бие биеэ нударцгаав.
common_voice_mn_23409572|unused|Одоогоор хураахад нэлээн төвөгтэй, хураагаад олигтой орлого болж чадахгүй татваруудыг орон нутагт өгсөн байгаа.
common_voice_mn_23409579|unused|Ээж таныгаа гэсэн сэтгэл минь эрдэнэ амласан ч Гималайн зүг урвахгүй ээ.
common_voice_mn_23409580|unused|Зочид буудлын цонхоор барилгад үлдсэн хүмүүс гар утасныхаа гэрлээр дохио өгч байна гэв.
common_voice_mn_23409586|unused|Бид хийсэн ажил, дэвшүүлсэн саналуудаа олон улсын байгууллагуудад илгээгээд явж байгаа.
common_voice_mn_23409587|unused|Суудлын машин ч хэн нэг нь биднийг дуудав гэж мэдээд зайдуухан очоод зогсжээ.
common_voice_mn_23409588|unused|Гэхдээ түүнийг зарим хүнстэй хамт хэрэглэвэл дээрх ашигтай чанар талаар болдог ажээ.
common_voice_mn_23409595|unused|Чи суурь руу яваад тэсвэртэйхэн гурав хоноод ирээч.
common_voice_mn_23409607|unused|Анжелика биеэ барьж чадалгүй инээд алдаад тэр дороо улайж орхилоо.
common_voice_mn_23409609|unused|Муу хар сэгийг буудаарай хэмээн зэрэг зэрэг хашхиралдан морины хурдаар давхилдана.
common_voice_mn_23409620|unused|Хоёр дахь удаагаа хорин хором бол.. Гурав дахь удаад гучин хором гэх мэтээр.
common_voice_mn_23409622|unused|Цус нэгт монголчуудаа дээрэмдсэн түүнд одоо эргэлзэж тээнэгэлзээд байх юмгүй болжээ.
common_voice_mn_23409626|unused|Тогтсон үзлийг эвдэгч хэмээн тус банкны ядуурлын судалгааны ахлагч Франсиско Ферреира уг судалгааг үнэлэв.
common_voice_mn_23409630|unused|Жил ирэх тусам Хөвсгөл нуурыг зорих гадаад, дотоод жуулчдын тоо нэмэгдсэн сурагтай.
common_voice_mn_23409638|unused|Саяхныг болтол би энэ загварыг Монголд оруулж ирэх боломжгүй гэж бодож байсан.
common_voice_mn_23409644|unused|Харин Теорем түүнийг давж чадсан мэт харагдана.
common_voice_mn_23409648|unused|Үүний дараа илүү ханамжтай царайлан сандалд суулаа.
common_voice_mn_23409649|unused|Хар шороон хөрсөнд уусан шингэсэн нь олонтой!
common_voice_mn_23409652|unused|Энэ нэгэн өдрийг л одоо тэр хоёр сэтгэлдээ дүрслэн бодож байсан биз ээ.
common_voice_mn_23409653|unused|Навчгүй мөчир нүцгэн гар сарвайх адил тэнгэр өөд сэрийж, гунигт дуу аяархан аялна.
common_voice_mn_23409659|unused|Өндөр албан тушаалын хүнийг хэд хэдэн янзаар элчингээр явуулна.
common_voice_mn_23409660|unused|Ноён Сасакийн дэргэд арга буюу саатах болсон Лодой "Зүгээр та зоволтгүй" гэлээ.
common_voice_mn_23409667|unused|Тэд эцсээ хүртэл хүчээ шавхсаар үхэж байсан ч номхон хүлцэнгүй болоогүй юм.
common_voice_mn_23409668|unused|Тэмүжин чиний юу хэлснийг ч санаж байна.
common_voice_mn_23409672|unused|Түүнийг дургүй айлд нь оруулах гэсэн нь юу юунаас ч илүү түгшээжээ.
common_voice_mn_23409675|unused|Гүйлгээний утга хэсэгт торгуулийн хуудасны бар кодыг л бичихэд хангалттайг иргэд анзаарахгүй байна.
common_voice_mn_23409677|unused|Тэд манай шашныхаас илүү идэвхтэй бөгөөд олон төрлийн үйл ажиллагаа явуулдгаараа хүмүүсийг татдаг юм.
common_voice_mn_23409678|unused|Гэхдээ Дээд Монголчуудын шашингүй болох үндсийг зөвхөн коммунизм, марксизмтай холбон үзэж бас болохгүй юм.
common_voice_mn_23409679|unused|Үрийн мөрөөдөл болсон л нэг хөөрхий амьтан шүү дээ.
common_voice_mn_23409686|unused|Эргэн харахад сумын төвийн барилгууд модны чөлөөгөөр цайвартах нь нэн ч содон.
common_voice_mn_23409689|unused|Шашны үзэл номлол, сургаалыг уламжлалт бус аргаар олон нийтэд хүргэх замыг эрэлхийлбэл сонирхлыг татна.
common_voice_mn_23409692|unused|Энэ байшингийн эзэн болох ах чинь их баян байсан.
common_voice_mn_23409697|unused|Энэ нь социалист нийгмийн үед буруутгаж, дорд үзэж байсан хандлагад өгсөн хариу үйлдэл юм.
common_voice_mn_23409704|unused|Хүчилтөрөгчийн коктейлийн ач тус нь хялгасан судасны цусны урсгал хурдсаж цусан дахь хүчилтөрөгч нэмэгдэнэ.
common_voice_mn_23409706|unused|Жинхэнэ байгууллынх нь эсрэг тэмцэнэ гэхэд аюултай хэрэг.
common_voice_mn_23409707|unused|Бадарч Долгор хоёр наадмаар танилцсанаас хойш уулзаагүй.
common_voice_mn_23409716|unused|Артур надад огтхон ч талархахгүй юм.
common_voice_mn_23409718|unused|Өөрөөр хэлбэл, хүмүүс амьдрал дээр болж байгаа бодтой явдлууд дээр үндэслэн үндэсний үзлээ зохиодог.
common_voice_mn_23409726|unused|Нарийвчилбал, морин дээр суусан нь цэмцгэр бөгөөд зайлшгүй Балгармаа мөн.
common_voice_mn_23409735|unused|Хайрдаг хаздаг хоёр бууранд нь хоёр хормой хужир шорвогоо тавьж өгчээ.
common_voice_mn_23409736|unused|Хагас сайн өдөр нийт хүүхдүүд халуун усанд орж ариун цэвэр сахиж байлаа.
common_voice_mn_23409739|unused|Сэтгэлд мөнхөрсөн ээжийн минь ариун цагаан мөр бий!
common_voice_mn_23409742|unused|Энэ үнэгчилж байгааг нь хэмээн дуу алдаж анир чимээгүй байдлыг эвдлээ.
common_voice_mn_23409745|unused|Түүхий хулуу чи бас унтмаар санагдаж байгаа биз!
common_voice_mn_23409754|unused|Тэр нь халаасандаа мөнгө ч үгүй, бусдын гэрт ажиллаж амьдарч байгаа.
common_voice_mn_23409770|unused|Аврорагийн учиртай харцыг анзаарсан хүмүүс эзнийг нь олохоор ийш тийш харж эхэлжээ.
common_voice_mn_23409774|unused|Жаргал үзээгүй өссөн хүн гэдэг үнэн юм.
common_voice_mn_23409775|unused|Миний шалгуур надаас оёж татвар авсан" гэсэн шиг болно.
common_voice_mn_23409783|unused|Энэ ангийнхан Чулуунд чухам ямраар хандаж байсан бол оо.
common_voice_mn_23409784|unused|Гологдлыг шалгах гурав дахь арга бол хяналтын багажхэрэгслэл юм.
common_voice_mn_23409787|unused|Бид хоёр ижилхэн бор морь унаад дөрөө зурам ургасан тарианы захаар шогшуулж явна.
common_voice_mn_23409790|unused|Мөрөн дээгүүр эхлээд Луис анзааралгүй гишгэлэн явснаас зарим газраар баларчээ.
common_voice_mn_23409796|unused|Уран бүтээлээрээ өдөр тутмын амьдралаас төрсөн сэтгэгдэл, бодрол, харсан үзсэн зүйлсээ илэрхийлдэг.
common_voice_mn_23409800|unused|Нэлийсэн гэрэл гэнэт эгшин зуур тэнгэрийг бүрхсэн шигээ эргээд хураагдав.
common_voice_mn_23409802|unused|Тэдний аав нь хөвгүүдийн сургуульд багш, ээж нь охидын сургуулийн захирлаар олон жил ажиллажээ.
common_voice_mn_23409810|unused|Гэхдээ дайн дажингүй, цаг амгалан болбол гэж санаа алдан шивнэжээ.
common_voice_mn_23409813|unused|Жан овогт сүхээр цохиулсан мэт ханзан дээр яг хийтэл суув.
common_voice_mn_23409814|unused|Өндөр хөгжилтэй гэгддэг орнуудад эцэг эхчүүд хүүхдүүдийнхээ цахим ертөнцөд өнгөрөөх цагийг хязгаартай байлгадаг.
common_voice_mn_23409818|unused|Хятадыг захирах эрх эдгээр хаадаас дараагийн хаанд уламжлахыг "зүй ёсны" гэж үздэг.
common_voice_mn_23409820|unused|Эх орны төлөө тэр хэдэн хятадын амин золиос байлгүй яах вэ?
common_voice_mn_23409826|unused|Лхүмбэнгарав, Мөрөн, Төгсбаяр зэрэг туршлагатай тамирчидтай хамтдаа тоглож байлаа.
common_voice_mn_23409832|unused|Шунлайв нь цанид дацангийн хурал ном, сургалт шүүлгийн асуудлыг хариуцан удирдана.
common_voice_mn_23409835|unused|Цагаан тугийн дохиогоор ч юм уу, манай талынхны хүчтэй гал тэрхэн зуур зэрэг зогсов.
common_voice_mn_23409838|unused|Очих бүрий л ажил төрөлтэй явчихсан байдаг сан.
common_voice_mn_23409841|unused|Биднийг зогсоож байгаад зургийнхаа аппаратаар чад хийлгээд дарсан юм гэв.
common_voice_mn_23409850|unused|Сүйх тэргэнд ямар хүн байсан бэ?
common_voice_mn_23409855|unused|Амьтдын хоол, бохирдуулагч бодис, шим тэжээлт бодисыг дахин сэргээгчийн үүргийг шавж гүйцэтгэдэг.
common_voice_mn_23409858|unused|Харин тэд бол гэрийнхээ босгыг даваад монголоор ярьж амьдрах арга мухардах байдалд ордог юм.
common_voice_mn_18577548|unused|Өглөө таван үг ч хэлүүлэхгүй барьж идчих гээд байх чинь билээ.
common_voice_mn_18577560|unused|Чи ч ёстой гандан буурахгүй нохой юм даа.
common_voice_mn_18577562|unused|Бидний ард морьдын төвөргөөн зөөлөн хөрсийг товшиж, адуу тургилах чимээ чийгт мананг цуулж ирэв.
common_voice_mn_18577564|unused|гэтэл хэдэн хүүхдүүд том болж сургууль соёл бараадах боллоо.
common_voice_mn_18577565|unused|Хөөрхий Туяа минь тал шиг сайхан сэтгэлтэй, даанч даруу бүсгүй шүү.
common_voice_mn_18577568|unused|Үүний мөрөөр Дашчойлин хийд дээр ажиглалт асуулгын аргаар судалгаа авсан юм.
common_voice_mn_18577577|unused|Гэвч тэдэнд хаалга эвдэх хэрэг гарна.
common_voice_mn_18577592|unused|Таны хэрэг захиргааны журмаар их хөнгөн шийдэгдэнэ гэлээ.
common_voice_mn_18577607|unused|Тэгвэл би одоо хэлээд өгье.
common_voice_mn_18577610|unused|Ном сурах бичиг авч өгөх хэрэгтэй.
common_voice_mn_18577612|unused|Дорж чи морь уургалахдаа, хэзээний нэртэй алдартай уургач Нэрэнхүүгээс давуу болоод байна.
common_voice_mn_18577616|unused|Хэрэв танд ямар нэг онцгой асуудал байхгүй бол утсаа тавиад дараа залгана уу?
common_voice_mn_18577618|unused|Амьдралаа өөрөөр харж өөдрөг байя хэмээн замын турш бодоод гэртээ ирсэн юм.
common_voice_mn_18577628|unused|Хэрэв гай зовлон тохиолдвол юу ч тохиолдсон сэтгэлээ тайван байлгахыг л хүсэж залбирах ёстой.
common_voice_mn_18577631|unused|Тэр жилээ Насанбатыг өөр бүсгүйтэй гэрлэхэд л сая зүрх хөндсөн түгшүүрээс сэтгэл цэлмэж билээ.
common_voice_mn_18577636|unused|Хүмүүсээс олж харсан зүйл тань нэг ёсондоо таны өөрийн үзэл бодол юм.
common_voice_mn_18577637|unused|Танд энэ номыг худалдаж авах хүсэл төржээ.
common_voice_mn_18577638|unused|Та хоёр энд толгойн халх барьж ав гэжээ.
common_voice_mn_18577640|unused|Хоймрын банзан орон дээр нэг хүүхэд мод зорьж сууна.
common_voice_mn_18577643|unused|Ганцаараа гудамжаар галзуу солиотой хүн шиг инээгээд, шоолоод ч хөхрөөд л байснаа санадаг юм.
common_voice_mn_18577644|unused|Хэмжээ хязгааргүй их иддэг, бие засах, хүндрэхээ удирдаж чадахгүй бэрхшээл тулгарсан.
common_voice_mn_18577656|unused|Гэтэл, харамсалтай нь хориод жилийн өмнө түүх дурсгалын зүйлийг сүйтгэж байсан хүмүүс бий.
common_voice_mn_18577677|unused|Тэтгэврийн дансны карт дээрээ олон оронтой нууц дугаараа том хараар тэмдэглүүлж авчээ.
common_voice_mn_18577678|unused|Ердөө л ингэж харахын тулд амьд үлдсэн мэт.
common_voice_mn_18577685|unused|Компани ч бай сургууль ч бай хэцүү.
common_voice_mn_18577696|unused|Манай хаанд ямар сайхан зохино вэ?
common_voice_mn_18577700|unused|Энэ явцад Монгол Улсын зүгээс төдийлөн идэвхтэй анхаарч ажиллаагүй юм.
common_voice_mn_18577705|unused|Гэсэн ч хөрөг дээрх хатагтай гайхалтай байсан санагдана.
